{
  "failed_checks": 0,
  "maximum_bound_violation": 0.0,
  "maximum_integrality_residual": 0.0,
  "maximum_quantity_residual": 0.0,
  "maximum_unit_cost_residual_eur_per_unit": 0.0,
  "maximum_value_residual_eur": 0.0,
  "quantity_checks": 0,
  "reconciliation_pass_flag": false,
  "run_id": "PLACEHOLDER",
  "scenario_id": "PLACEHOLDER",
  "unit_cost_checks": 0,
  "value_checks": 0
}
